{
  "contract_version": "1.0",
  "agent_run_id": "run_100",
  "tenant_id": "ten_pet_store",
  "actor_id": "user_owner",
  "trace_id": "4bf92f3577b34da6a3ce929d0e0e4736",
  "workflow_instance_id": "wf_publish_100",
  "agent_type": "merchant",
  "status": "waiting_approval",
  "created_at": "2026-08-21T10:00:00Z",
  "updated_at": "2026-08-21T10:00:02Z",
  "message_ids": ["msg_100"],
  "step_ids": ["step_100"],
  "approval_request_id": "approval_100",
  "attempt": 1,
  "retry": {
    "retryable": false,
    "retry_count": 0,
    "max_retries": 3,
    "next_retry_at": null,
    "backoff_ms": null,
    "last_error_code": null
  },
  "accounting": {
    "model": "model-main",
    "input_tokens": 120,
    "output_tokens": 40,
    "total_tokens": 160,
    "cost_minor": 2,
    "currency": "USD",
    "latency_ms": 850
  },
  "failure": null,
  "audit_id": "audit_run_100"
}
